<?xml version="1.0" encoding="UTF-8" standalone="no"?>

<!DOCTYPE mesTests SYSTEM "testDtd.dtd">


<mesTests>
<testDePersonnalite>
<titre>Tes atouts pour la rentree </titre>
<accroche>Mieux vaut avoir de bonnes cartes en main pour reussir la rentree scolaire</accroche>
<questionnaire>
<questions id="1">
<intituleQuestion>Devoir de vacances</intituleQuestion>
<reponses id="10">Tu as travaille un peu de tps en tps pr te remettre ds le bain</reponses>
<reponses id="10">Tu les as faits regulieremt et ac serieux car tu en avais besoin</reponses>
</questions>
<questions id="2">
<intituleQuestion>La semaine derniere (tu peux cocher plusieurs reponses)</intituleQuestion>
<reponses id="20">Tu as profite au maximum de tes derniers jours de vacances</reponses>
<reponses id="20">Tu as achete de nouvelles fringues ac tes copains (copines) </reponses>
</questions>
<questions id="3">
<intituleQuestion>Cette annee tu esperes surtout</intituleQuestion>
<reponses id="30">Bien travailler</reponses>
<reponses id="30">Etre dans une classe tres sympa</reponses>
</questions>
</questionnaire>
</testDePersonnalite>

<testDePersonnalite>
<titre>blop</titre>
<accroche>forc</accroche>
<questionnaire>
<questions id="1">
<intituleQuestion>q?</intituleQuestion>
<reponses id="11">afe</reponses>
<reponses id="12">faef</reponses>
</questions>
<questions id="2">
<intituleQuestion>q?</intituleQuestion>
<reponses id="21">feafe</reponses>
<reponses id="22">faefae</reponses>
</questions>
<questions id="3">
<intituleQuestion>q?</intituleQuestion>
<reponses id="31">erdfaef</reponses>
<reponses id="32">fe</reponses>
</questions>
</questionnaire>
</testDePersonnalite>
</mesTests>
